{"schema_version":1,"tool_version":"dev","target":"nginx","tested_version":"nginx 1.30.4","analysis_id":"an_2d7768d29368c85cbdef71fad5833d19","run_id":"pr_4dec89bcc88156e4","policy_hash":"219d728ccef8be2aec0d5511ee71551b8001cb179906f14c2292bb58de37923f","simulation_sha256":"5326b374ef0ce6b984ff8b3786eaaffc9f0e848089055668a1a58acf84a49672","workspace_manifest_sha256":"df5ea10528fdc4a6c4e701e393f6b4e92c411a9dcf461615df2e0ab668de01d5","acknowledged_risks":["claimed-allow-bypass:allow-googlebot"],"files":[{"name":"crawlledger-http.conf","bytes":505,"sha256":"8c5a0cc6dc8b00affd2175431b0adee16bcf38ac677182249aef877e10848b29"},{"name":"crawlledger-server.conf","bytes":127,"sha256":"c8439df01e6d89655a00d89084971bc1989e8a68f8ae719749f321d78e2d98bc"}],"nginx_zones":[],"instructions":["Include crawlledger-http.conf inside http {}.","Include crawlledger-server.conf inside the audited server {} before the content handler.","Create a backup of the active configuration.","Run nginx -t.","Reload Nginx manually.","Check 403, 429 and access logs.","Roll back manually if validation fails."],"not_applied":true}
