{"schema_version":1,"tool_version":"dev","target":"caddy","tested_version":"caddy 2.11.4","analysis_id":"an_2d7768d29368c85cbdef71fad5833d19","run_id":"pr_4dec89bcc88156e4","policy_hash":"219d728ccef8be2aec0d5511ee71551b8001cb179906f14c2292bb58de37923f","simulation_sha256":"5326b374ef0ce6b984ff8b3786eaaffc9f0e848089055668a1a58acf84a49672","workspace_manifest_sha256":"df5ea10528fdc4a6c4e701e393f6b4e92c411a9dcf461615df2e0ab668de01d5","acknowledged_risks":["claimed-allow-bypass:allow-googlebot"],"files":[{"name":"Caddyfile.crawlledger","bytes":492,"sha256":"799576c882bb77aba672a8d99bdd674f6a0ce5e2f3e032fa909bf3e5d61cb7d4"}],"nginx_zones":[],"instructions":["Import Caddyfile.crawlledger before reverse_proxy.","Create a backup of the active configuration.","Run caddy adapt --config Caddyfile --adapter caddyfile --validate.","Run caddy validate --config Caddyfile.","Reload Caddy manually.","Roll back manually if validation fails."],"not_applied":true}
